text,normalized_text
یہ بھی مانگے کا مالک کے حکم سے ۔۔جتنا بھی گم نام ہو جا ے ۔۔ اللّه سے نہی چھپ سکتا #URL#,url
میں یہ نہیں کہوں گا کہ یہ ایک * برا * فلم ہے. میرے لئے بدقسمتی سے، میں باڑ کے بارے میں ہے کہ اس سے زیادہ آپ کو پتہ ہے کہ احساس حاصل، بدتر یہ صرف حقیقت کی وجہ سے یہ مکمل طور پر غیر حقیقی ہو جاتا ہے کہ کرنے کے لئے ہو جاتا ہے. میں نے 14 سال کی تھی میں نے باڑ گیا ہے، اور اس فلم کو بہت غیر تسلی بخش جو پیش کیا. F. مرے ابراہیم اچھا ہے (اور کچھ باڑ لگانے کے پس منظر ہے ظاہر ہوتا ہے)، لیکن دیگر اداکاروں میں سے اکثر - خاص طور پر طالب علموں - بس ختم ہو جائے کرنے کے لئے لگ رہے ہو.,14 f
میں ایک کاروبار کی فروخت کے باہر جا کر پچاس سینٹ کے لئے اس فلم مل گئی. میں نے اپنے پچاس سینٹس واپس چاہیئے. برا اداکاری، غریب سکرپٹ رائٹنگ، ناقص سمت، تاریخی طور پر غلط، فلم کی بھی آواز خوفناک ہے. اس سے مشروط ہے کہ خفا معاملہ نہیں ہے. میں نے جو راز فلموں اور سچ جرم فلمیں بہت دلچسپ لگتی بہت سے ایک ہوں. موضوع کے تفصیل اور درستگی کے لئے بہت زیادہ توجہ کے ساتھ، زیادہ سنجیدگی سے علاج کیا، اور متاثرین اور ان کے تباہ دوستوں اور خاندان کے لئے دکھایا احترام کی کمی کی وجہ سے کسی کو پہیلی کرنے کے لئے کافی ہے. اس کے علاوہ، کوئی توجہ کسی کو عجیب رویے ایڈ Gein ان خوفناک جرائم باہر اداکاری میں نمائش کی گئی تھی کہ شروع کرنے کے لئے کی وجہ سے ہو سکتا ہے کے لئے ادا کرنے کے لئے بہت کم ہے. <br /> <br /> آپ کا وقت اور وویک کو محفوظ کریں. یہ خوفناک فلم نہیں دیکھتی. آپ نے اسے خریدا تو، آپ کو میری ہمدردی ہے. یہ اگرچہ ایک کل فضلہ نہیں ہے ... آپ کو پلاسٹک کیس کے ڈسک اور میک استعمال پھینک کر سکتے ہیں!,gein
خان صاحب میں 12 سال سے آپ کے ساتھ ہوں آپ میرا مکمل ریکارڈ چیک کرے لیکن افسوس میں ایک مزدور کا بیٹا ہو لیکن کبھی لوٹا نہیں بنا اور میں اللہ کی پاک کتاب قرآن پاک پر حلف لیتا ہوں PS. 82 سے مجھے ٹکٹ ملا مجھے سیواۓ موت کے آپ سے کوئی دور نہیں کرسکتا @ImranKhanPTI #USER# #URL#,12 ps 82 imrankhanpti user url
خُدایا کب تک اور کہاں تک میں تُجھ سے برابر رضا کی درخواست کرتا رہوں گا اور تُو مجھ میں کوئی صداقت اور وفاداری نہ پائے گا۔ فریاد!! اس خواہش سے جو مجھ پر غالب آگئی ہے، جِس دشمن نے مجھ پر قبضہ کرلیا ہے، دنیا میرے سامنے آراستہ ہوگئی ہے اور وہ نفسِ امارہ جو برائیوں کا حکم,
#USER# پیاز کی جیسی بد بودار تیری منہ ہے اور شکل خچر جیسی دنیا کا کرپٹ چور آدمی تجھے اس سب کا صلہ اللہ قبر میں دے گا انشا اللہ,user
#USER# #USER# کاش کہ یہ ممکن ہوتا۔ واپسی کے بدلے اللہ پاک کسی کی جان مانگتا تو مجھ سمیت لاکھوں پاکستانی حاضر ہوتے۔ کاش کہ ایسا ہوتا۔ @arsched,user user arsched
#USER# نئے سپہ سالار سے امید ھے کہ وہ عوام اور پاک فوج میں دوریاں ختم کرنے کیلئیے اپنا بھرپور کردار ادا کریں گے۔میرے دیس کی شان افواج پاکستان #اسلام_ہمیں_سکھاتا_ہے,user
#USER# نہ منظور پشتون غدار ہے نہ علی وزیر نہ۔۔نہ فاطمہ جناح غدار تھی۔۔غدار ایوب تھے، غدار یحییٰ تھے، ضیا تھے، مشرف ہے، کیانی ہے، باجوہ ہے، ہم قبائل انشا اللّہ جب بھی افغانستان ڈیورنڈ لائن اپنانے کی کوشش کرے گا ان کا بھرپور ساتھ دینگے، یہ ایٹم بم، یہ فوج آپ کو مبارک ہو۔,user
اس فلم کی کل بور ہے. Entrapment کی تمام پہلوؤں، پلاٹ، اداکاری، سٹنٹ، وغیرہ میں راستہ بہتر ہے پلس صوتی ٹریک سے سب سے زیادہ پریشان کن میں نے کبھی سنا ہے میں سے ایک ہے. میں نے صرف اسے چپ رہو فلم کو خاموش کرنے کے قریب تھا. 10 ستاروں کے 3 باہر ***,entrapment 10 3
میں نے اس فلم کو دیکھا تو میں نے سوچ سکتا تھا: کیا ایک آفت! نہیں میں آتش فشاں کے بارے میں بات نہیں کر رہا ہوں، لیکن فلم خود کے بارے میں. میں نے فلموں کی ایک بہت کچھ دیکھا ہے، لیکن یہ یقینی طور پر کبھی بدترین میں سے ایک ہے. میں اس حقیقت کے بارے میں پرواہ نہیں ہے شہر کے مرکز میں ایل اے کے نیچے نبرد ایک آتش فشاں ممکن ہے یا نہیں. شاید یہ نہیں ہے، لیکن اس سے بھی زیادہ ایک اچھی فلم ہو سکتی تھی ... لیکن یہ یقین نہیں ہے اور میں آپ کیوں اس بات کی وضاحت کریں گے. <br /> <br /> مجھے پتہ نہیں کتنی اضافی بہاؤ اوسط آتش فشاں سے باہر، لیکن اس فلم میں آتش فشاں سے Vesuvius، یٹنا اور ماؤنٹ Pinatubo مل کر ایک چھوٹا سا باربیکیو کی طرح نظر بناتا ہے کہ کیا مجھے پتہ ہے. مجھے نہیں لگتا کہ کبھی بھی اتنا لاوا ہم اس فلم میں دیکھتے ہیں کے طور پر ایک آتش فشاں سے باہر بہہ ہوا ہے. مجھے یقین ہے کہ ہدایت کار ان کی فلم پر خرچ کرنے کے لئے پیسے کی ایک بہت تھا رہا ہوں، لیکن وہ سب کے خاص اثرات پر خرچ کیا اور اسکرپٹ اور اداکاروں پر نہیں کیوں مجھے واقعی حیرت ہے. میں یہ نہیں کہہ رہا ہوں کہ وہ سب سے کاسٹ کی خدمات حاصل کرنا چاہئے تھا، لیکن یہ واقعی میں اچھا اداکاری کو فون کیا کے برعکس ہے. ان کی پرفارمنس بہت unbelievably غریب جو پوری فلم بھی بدتر ہوتا ہے کہ ہیں. <br /> <br /> اور آپ کو شاید اپنے آپ سے پوچھنا سکرپٹ بارے میں غلط کیا ہے. ٹھیک ہے، آپ مجھے بتا سکتے ہیں کے بغیر اضافی سے چند گز یا اس سے بھی چند فٹ کھڑے لوگوں کے خیال کے ساتھ آتا ہے جو جلا یا ہیت کو چھپانے کے لئے ہونے رہی؟ یا لوگوں کو زمین میں دھنستا اضافی کے بہاؤ بھی دو پاؤں زیادہ نہیں ہے جب؟ <br /> <br /> میں نے نہیں ہوگا میں نے اس طرح ایک سکرپٹ لکھا، لیکن بظاہر ہالی وڈ میں اسکرپٹ لکھنے والوں believability بارے اعتراض نہیں ہے جو اس کے اچھے پیسے ادا کرتا جب تک موجود ہیں پر فخر ہے تو یقین ہے! بہت اچھا پیسہ !!! <br /> <br /> آپ کی فلم دیکھتے ہیں تو آپ میرے ساتھ شاید مان جائیں گے کہ یہ ہالی وڈ کی بدترین آفت فلموں میں سے ایک، ایک 3/10 کے مقابلے میں نہ مالیت زیادہ ہے.,vesuvius pinatubo unbelievably believability 3 10
#USER# عنقریب ایک ہی رہ جائے گی انشا ء اللہ  P.T.I,user p t i
ٹی وی پر یہ دیکھا. مجھے خوشی ہے کہ میں نے یہ دیکھ یا رینٹل پر پیسہ خرچ کرنے کے لئے سینما جانے نہیں دیا ہوں. بدعنوان مالک اور یوجناکار سے، بل کھاتی بجلی کی کیبلز کے لئے - فلم مکمل طور پر امکانات ہے. پلاٹ واقعی کمزور اور ناقابل اعتماد ہے - ہمسھلن ماہر آدمی کو توڑنے ہمسھلن (اصل فوٹیج استعمال کرتے ہوئے) ہڈی کا ایک 20 فٹ کی لہر کی طرف سے مارا جاتا ہے اور وہ کیا کرنا ہے تمام کھڑے ہو جاؤ اور خود نیچے ہلا ہے. ایک ملین میل ایک گھنٹے میں نیچے ہمسھلن گرج اور سڑک کے کنارے پر مردہ روکتا ہے. <br /> <br /> اصل ہمسھلن مواد میں سے کچھ متاثر کن ہے اور اس کے تباہ کن طاقت سے ظاہر ہوتا ہے. لیکن حقیقی برفانی تودے اور نکالی چیزیں درمیان معاہدہ کی بھی flimsier اس فلم نظر ہوتا ہے. <br /> <br /> اپنے آپ کو ایک یہسان کرو، یہاں تک کہ ٹی وی پر اس ایک کے ساتھ فکر نہیں کرتے,20 flimsier
#USER# ڈیزل عالم نہیں بلکہ اقتدار سے بندھا ہوا کتا ہے۔ جو وزارت کیلئے کسی بھی حد تک گر سکتا ہے۔ عمران خان کو اپنے کمرے میں دیکھنے کی خواہش شاید فضل الرحمن کی بیٹی نے اور ماں کے ساتھ زنا کی خواہش فضل الرحمن کے بیٹے نے کی ہوگی۔ توبہ اس بد بخت کیلئے بھی لکھتے ہوئے ایسا میرے ہاتھ کانپے,user
"آپ آنکھ کینڈی کے لئے تلاش کر رہے ہیں تو، آپ کو اسکائی کپتان لطف اندوز ہو سکتے ہیں. اسکائی کپتان لائیو اداکاروں کے ساتھ انجکشن صرف ایک ویڈیو گیم ہے. visials میں پوری فلم کے دوران اچھا اور نظر کے لئے دلچسپ ہے. اب، یہ کہہ، انداز اسکائی کپتان میں صرف ایک ہی چیز اچھی ہے. <br /> <br /> دس منٹ کے بعد، میں نے تمام وقت کے بدتر فلموں میں سے ایک دیکھ رہا تھا جانتے تھے. مجھے امید تھی اس فلم بہتر ہو گا، لیکن یہ سود کے کسی بھی ڈگری حاصل کی ہے کبھی نہیں. تیس منٹ کے بعد، خواہش بڑھتی ہوئی اور بڑھتے باہر چلنا. اب، میں 2000 سے زائد فلموں کے مالک ہیں اور تعداد میں کہ شاید پانچ مرتبہ دیکھا ہے. پھر بھی اس نے اپنی پوری زندگی سے باہر چلنے کی طرح محسوس کیا صرف دوسری فلم ہے. <br /> <br /> قائم مقام --- کوئی نہیں ہے. تین اہم اداکاروں قابل رحم ہیں. جوڈے قانون (بھی دیگر فلم میں میں نے باہر چلنے کے لئے چاہتا تھا) عنوان کردار میں صرف خوفناک ہے. میں نہیں بلکہ ایک بار پھر گھڑی قانون کے مقابلے Gigli میں بین Affleck ذریعے بیٹھتے تھے. <br /> <br /> پالٹرو جو اس کے چہرے میں الٹا اثر ہو، campy کے ہونے کے لئے اتنا مشکل کی کوشش کرتا ہے. گزشتہ مضمون میں نے پڑھا تھا کہ پالٹرو گھر رہنے اور کیا جا رہا ہے ایک ماں کی بجائے اداکاری کے بارے میں سوچ رہا ہے. اس کارکردگی کے بعد، میں نے اس فیصلے کی تعریف کریں گے. <br /> <br /> کہانی --- ڈرامے بہتر لکھے جاتے ہیں. اسکائی کپتان کے پیچھے کی کہانی برا شروع ہوتا ہے اور اسے ترقی کے طور پر مسلسل بدتر ہو جاتا ہے. <br /> <br /> ہدایت --- کوئی بھی نہیں. سب کچھ خاص اثرات کہانی، اداکاری اور شدید مصائب برداشت ہدایت کہ میں ڈال دیا گیا تھا. یہاں تک کہ ""پریت لعنت"" بہتر اداکاری اور یہ کہ ایک بڑا سودا کہہ نہیں ہے تھا. <br /> <br /> میں نے یہ فلم ایک ""0"" ""10"" سے باہر دینے کے لئے ہوگا. تھیٹر کی قیمتوں کی ادائیگی سے بچنے اور ویڈیو ریلیز تک انتظار.",visials 2000 gigli affleck campy 0 10
"آسانی سے بہتر ہو سکتا تھا. اصل میں شاید اتنا تو فلم ساز بھی اس نے کیا کے طور پر مشکل کے طور پر کوشش نہیں کی تھی، تو یہ اصل میں بہتر ایک اچھی بات پر ہو سکتا ہے. <br /> <br />. روشنی کے علاوہ معقول ٹھیک تھا. لیکن کسی اور بہت زیادہ سب کچھ کمی تھی. ڈانواڈول کیمرے کا کام. (جی ہاں، ہاں، میں جانتی ہوں کہ اب سٹائل ہونا چاہیئے.) غیر تسلی بخش ریکارڈ شدہ آڈیو. اور اس میں ترمیم کسی نے دیکھا بھی کئی Ulli Lommel فلموں کی طرح لگ رہا تھا کہ (بدترین ترمیم کی فلموں میں سے کچھ ہیں.) یہ خلاصہ، فلم ڈائریکٹر / مصنف / کچھ نوجوان خواتین ننگے ہو جاؤ کرنے کے لئے اہم کردار کے لئے ایک معقول بنانے لگ رہا تھا جعلی غلامی میں ڈال، اور، ان کو ٹٹولنا کہہ جبکہ چیزیں ""دھمکی آمیز"".",ulli lommel
پہلا دور دانیال، وحی، متی 24، یسعیاہ اور دیگر پیشن گوئی صحائف کا مطالعہ کرنے کے ساتھ کچھ بھی غلط نہیں ہے. انجیل پیغام کو پیش کرنے کی کوشش کرنے کے لئے اس طرح ایک فلم بنانے کے ساتھ کچھ بھی غلط بھی ہے. لہذا اس فلم کے ساتھ میری باک اس کے اخلاص یا امنگوں یا تو میں نہیں ہیں. ایک عیسائی کے طور پر، ایک amillenialist اگرچہ، میں نے ایک بڑی مصیبت ہو جائے گا یقین رکھتے ہیں اور میں نے اس کو اس نے جتنا کہا مسیح واپس آ جائیں گے یقین ہے. میں نے اس فلم کم اتنا بندی کیوں کہ نہیں ہے بے خودی کے بارے میں اس فلم کے ساتھ اختلاف ہے تو اگرچہ. <br /> <br /> کوئی، کیا، اتنی کم اس کے اخلاص یا اس کے پیغام کو نہیں وہ میرے اس فلم کا ہوتا ہے لیکن بلکہ پیداوار اقدار کی کمی، خوفناک سکرپٹ معمولی اداکاری، اور قابل رحم FX. یہ فلم 1950s کے cheesiest لینڈ چارہ سے کچھ کے ساتھ وہاں نیچے نمبر پر ہے. نہیں، یہ فلم Outerspace سے Plan 9 کے ساتھ وہاں نیچے نمبر پر ہے. یہ فلم اچھی طرح عمر میں ناکام رہے اور شاید وہ ایک نتیجہ بنا دیا وقت کی طرف سے مورخہ کیا گیا تھا. <br /> <br /> Apocalypse کے سٹائل فلم کے پروڈیوسر کو اس کی طرف سے ایک آخر وقت فلم بنانے کے لئے کس طرح نہیں سیکھا جا سکتا تھا، لیکن وہ ناکام رہے. پیچھے سیریز بائیں، Apocalypse کی سیریز، اور ومیگا کوڈ سلسلہ تمام وہ FX مسائل اور تاریخ نظر مسئلہ خطاب کیونکہ اس سے سبق حاصل کرنے میں ناکام رہے، لیکن ان کی اسکرپٹ اب بھی غریب ہیں، اور ان کی اداکاری لکڑی ہے. <br /> < بی آر /> انتہائی کم بجٹ کے ساتھ عظیم مسیحی فلموں، ہیں، لیکن اس فلم کو ان میں سے ایک نہیں ہے. میں حیران ہوں MST3K عملے کو یہ ایک lampooned کیا کبھی نہیں.,24 amillenialist fx 1950s cheesiest outerspace plan 9 apocalypse apocalypse fx mst3k lampooned
"یہ اس بارکر گروہ کے ایک ""fictionalized"" اکاؤنٹ کو کال کرنے کی بھی قسم کی ہے. وہ حق ناموں کو مل گیا، لیکن اس سے اس بارے میں ہے. <br /> <br /> رسل، شہوت انگیز اب بھی ہے میں تمہیں وہ عطا کر لیں گے، لیکن یہ اصلی ما بارکر، جو بنیادی طور پر کھانا پکانے کی طرف سے لڑکوں کا خیال رکھا اور نہیں ہے کیا انہوں نے نہیں کی منصوبہ بندی یا جرائم میں شرکت کرکے، ملک بھر میں منتقل کر دیا جب مدد. میں نے اسے اس کے بچوں اور ان کے ساتھیوں کی مجرمانہ سرگرمیوں میں پکڑے ایک درمیانی عمر عورت کی اصل کہانی پیش کرنا کہیں زیادہ دلچسپ ہوتا لگتا ہے. <br /> <br /> میں نے بھی ان لوگوں کے مبصرین سے اتفاق ہے جو مکمل طور پر ناقابل اعتماد ہونے کے لئے باہر گولی مار مناظر پایا. بارکر / Karpis متاثرین معصوم کی اور قانون نافذ کرنے والے ایجنٹوں کو ان کا تعاقب کرنے والے کا ایک مجموعہ تھے، لیکن وہ یقینی طور پر نیچے نصف درجن ایف بی آئی کے ایجنٹوں کو ہر بار وہ گھیر کر رہے تھے گھاس کاٹنا نہیں کی. (دوسری طرف، کے طور پر کئی حالیہ کتابوں سے متعلق ہے، اس دور کا ایف بی آئی کو اس حد تک قانونی یا اکاؤنٹنگ پس منظر بہت سے ایجنٹوں بہت کم قانون نافذ کرنے والے یا آتشیں تجربہ تھا کہ سے آنے والے ایجنٹوں کے خیال پر زور دیا. وہ اچھی طرح سے نہیں تھے تربیت یافتہ ایجنٹوں ہم آج کی تصویر ہے.) <br /> <br /> لیکن سب سے بدترین گناہ فلم بنیادی طور پر ایک بور ہے کہ ہے. کوئی بھی تبدیلیاں کی، کوئی بھی اگتا ہے. ہم صرف نہیں جانتے جس شوٹ آؤٹ یہ ہو جائے گا. <br /> <br /> صرف مر مشکل رسل پرستار کے لئے جانتے ہیں کہ سڑک کے آخر آگے ہے.",fictionalized karpis
یہ ملک ہمارا ہے اور اس کی فوج بھی ہماری ہے۔ اگر فوج نے سیاسی دستکاری سے گریز کا ارادہ کیا ہے تو اس کا خیرمقدم کرنا چاہیے تاہم ’وصال یار فقط آرزو کی بات نہیں،۔,
"وفف - میں کیا کہنا نہیں ہے. یہ ایک فلم سنگسار ناظرین کے ایک گروپ کے ساتھ واقعی اچھا ایک ہو سکتا ہے. اداکاری سے کچھ جان واٹرس 'ابتدائی پرساد کی مجھے یاد دلایا. شاید میں نے اس کو واپس لینا چاہئے - میں نے ایک ڈائریکٹر / قصہ گو کے طور پر توہین واٹرس 'کی صلاحیت نہیں کرنا چاہتے ہیں <br /> <br /> میں خاص طور پر ""مکمل یقین اور ساکھ"" شق بارے لینے وکیل محبت کرتا تھا. یہ ""مکمل یقین اور کریڈٹ،"" راہ کی طرف! <br /> <br /> یہ بھی ""کانراڈ بوائز"" کے مرکزی اداکار بھی وغیرہ میں سے وہ لوگ چھانٹیں مصنف، ڈائریکٹر، فلم ایڈیٹر، ہے جہاں کی یاد دلاتی اس طرح کہ جیسے کثیر ملوث اپکرموں کو شاید سب بہت تجربہ کار فلم کے پیشہ ور افراد جنہوں نے اس طرح سے دور ھیںچو کسی چیز کو تکنیکی صلاحیت (ایک سٹنٹ ہی سہی، کچھ کہہ سکتا ہے) ہوگا کرنے کے لئے چھوڑ دیا جاتا ہے.",' '
حضرت  عمر بن خطاب  رضی اللہ سے روایت ہے کہ آپ صلی اللہ علیہ وسلم نے ارشاد فرمایا :جو شخص اچھی طرح وضو کرے اور پھر یہ پڑھے :أشهد أن لا إله إلا الله وحده لا شريك له، وأشهد أن محمدا عبده ورسوله، اللهم اجعلني من التوابين، واجعلني من المتطهرين،👇,
مندرجہ ذیل کے ساتھ دشمنی 2 کے ختم ہونے کے بارے میں سوچو: <br /> <br /> - ایک چرواہا - - ایک محبت کی کہانی - بار بار لفظ دھوپ کا کہنا ہے کہ ایک آدمی ہے جو سارہ مشیل Gellar خود کاٹنے - اور ایک عجیب عکس <بی آر / > <br /> OH اور پانی کے اندر سمندری جانور ... گرمیوں میں ... <br /> <br /> ایک اچھی فلم ہے ... میں نے سنجیدگی سے جو کچھ اس سے لطف اندوز نہیں کیا. فلم کے لئے پوسٹر انتہائی کے ساتھ ساتھ گمراہ کن ہے اور میں اسے دیکھ کر لوگوں کو چوستے کرنے کے لئے صرف تھا پتہ چلا ہے کہ ... مجھے یقین نہیں کہ میں چلا گیا. <br /> <br /> آپ کا وقت اور پیسہ ... جانے گھڑی دیکھا III ... ایک فلم کے لکھنے کو اس میں ... <br /> <br /> رکھا محنت بھی نہیں تھا آپ کی طرح محسوس ہوتا ہے جہاں میں محفوظ کریں مائیک اور آئی ایم باہر,2 gellar oh iii
سیاسی تنقید میں اداروں کو اور قومی شخصیات کو بیچ میں نہیں لانا چاہیئےامید ہے باقی تحریک انصاف کے کارکن بھی اس بات کا احساس کر لیں #URL#,url
"مجھے دونوں کے سینما گھروں میں اور گھر پر شاید 200 فلمیں ایک سال دیکھنے اور میں اعتماد کے ساتھ کہہ سکتے ہیں اس فلم اب تک سب سے بری نے اس سال دیکھا ہے کی طرف سے ہے (نہ کبھی، تاہم میں یہ نہیں اصل ""ڈیلٹا شورویروں کے کویسٹ"" دیکھا ہے تو ابھی تک). یہ فلم عمر 13 سال کے لئے تیزی لائی برا مذاق کے بعد صرف برا مذاق ہے اور میں تھا کیونکہ وہ ایک بس کے سفر میں باہر چل نہیں سکتا تھا پر یہ دیکھنے کی ناراضگی ہے. <br /> <br /> اپنے آپ کو ایک یہسان کرو اور اس کو چھوڑ دیں رینٹل گلیارے میں ایک. چار ڈالر بہتر جیری Bruckheimer کی طرف سے تیار تعداد کی طرف سے کسی بھی فلم پر خرچ کیا جا سکتا ہے.",200 13 bruckheimer
#USER# #USER# #USER# #USER# #USER# #USER# #USER# #USER# #USER# #USER# #USER# اللہ آپکو صبر جمیل عطا کرۓ یا اللہ ایسا واقعہ دوبارہ کبھی پیش نا آئے آمین ثم آمین 😭😭,user user user user user user user user user user user
شاید آپ لوگوں نے اللہ کا عذاب نہیں دیکھا ورنہ ایسی بات نہ کرتے ارو درتے أس وقت سے جب کا حکم ہو گا ارو تم لوگ کے پاوں کے نیچے سے زمین نکل جاے گی...یہ صرف کچھ وقت کی مہلت ہے سنبھل جاو پھر ٹائم نہیں ملے گا.. #URL#,url
"*""سلام الشجاع علیک یاامیر المجاہدینؒ""**•┈┈┈┈┈••✦TLP✦••┈┈┈┈┈•**_عزت اُسی کی ہو گی جو حضورﷺ کی عزّت کی بات کرے گا_*#Illegitimate_Israel #URL#",tlp illegitimate israel url
