text,normalized_text
A واقعی شاندار کاسٹ اور بہت باصلاحیت تکنیکی عملے کمرشل ردی کی اس صورتحال سے امکانات اور صاف طور حسب نسخہ ٹکڑا حمایت کرنے کو پریشان کر کے ہمارے یکساں طور پر قابل قدر فرصت کے وقت ان کے قیمتی کیریئر وقت برباد کیا، اور. فلم <br /> <br /> ایک غیر معمولی ہائی واقعی ایک اچھا اور بہت ہی حالات خیال پر مبنی ہے لیکن پروڈیوسر اور ہدایت کار دونوں کو صرف لاگو کیا معیاری ہالی وڈ 'آفت فلم' فارمولے اور اس طرح کی پیداوار سے کسی بھی ممکنہ قدر برباد کر دیا. لہر اور بہت مضبوط طوفان حالات لندن اور ٹیمز ویلی کے سب سے زیادہ سیلاب مغلوب ہے کہ ایک ریکارڈ اعلی طوفانی موج پیدا کرنے کے لئے جمع. ایک بہادر سائنسدان (ٹام کورٹینی) خطرے کے حکام تنبیہات اور بالآخر دن بچاتا ہے جو ارد گرد پلاٹ کے مراکز، ایک گلیمرس خاتون پولیس چیف پورے شو اور اہم دیکھ بھال کے لئے کی کوشش کرتا ہے جو ایک embattled نائب وزیر اعظم (ڈیوڈ سچیت) چلتا ہے. <br /> <br /> لیکن یہ سب اتنا غیر حقیقی ہے کہ صرف 30 منٹ کے بعد ایک توسیع کی چائے کے وقفے کی طرح ایک ہی محسوس ہوتا ہے. نوجوان گلیمرس خاتون پولیس کمشنر ایمرجنسی کا اعلان کر دیا اسٹیٹ دوران فوج پر مکمل اختیار کا مطالبہ ہے اور یہ ہو جاتا ہے (تو اس کو!). تجربہ کار جنرل صرف اس وجہ سے اس کے ظاہر برتر صلاحیت کے اس جوتے چاٹنا لئے ہے جو ایک مکمل پاگل کی طرح ایک طرف دھکیل دیا جاتا ہے. مصیبت ہماری لڑکی سپریمو، اب زندگی کے لاکھوں کے لئے ذمہ دار کی حالت میں، اس کی دو بیٹیوں ساؤتھ ویسٹ لندن کے دورے کو لے لیا ہے اور کہتے ہیں کہ وہ ٹھیک تھے ٹیلی فون کیا نہیں کیا ہے جو کی قسمت پر فکر کے اس وقت کے سب سے زیادہ خرچ کرتا ہے. ہمارے غالب عورت ان کے لئے نظر اس کے عملے کا تعین کرتا ہے اور فیصلہ تمام فوج اور امدادی خدمات کے لئے واحد ترجیح جنوبی مغربی لندن اور نہ شہر کے کسی دوسرے کوارٹر ہونا ضروری ہے تا کہ. کورس کے وزیر، فوج اور پورے وفد سوال کے بغیر اس کی ترجیح قبول کرتے ہیں. ایک صرف وہاں وہ سب تھا املاک کو فرض کر سکتے ہیں. اس کے بچوں کو آخر لامتناہی رپورٹس اور کوششوں کو اس کے عملے کی طرف سے وہ ہمارے مرد ہیرو کی طرف سے کہا جاتا ہے کے بعد پتہ چلا رہے ہیں، 'اہم بات یہ ہے کہ خدا نے وہ کر رہے ہیں محفوظ، شکریہ'. دوسروں کے لاکھوں یا دیگر تمام ذمہ داریاں وہ کنٹرول کرنے والا تھا کے بارے میں کوئی بات نہیں؛ جب تک اس کے اپنے بچے تھے کے طور پر محفوظ کیا سب کچھ ٹھیک تھا. <br /> <br /> یہ فلم اسی پرانے لڑکی chauvinist صنفی امتیاز طالی خواتین ہوشیار، احساس، دیکھ بھال اور مردوں کی حالت کو واضح طور پر قابل رہنما ہیں جسمانی بہادری، مورھ طاقت کے سوا کچھ نہیں کے لئے اچھی ہیں کہ ٹریپ آگے بڑھانے کے لئے صرف ایک بہانہ ہے اور بہت ماہر علم. اور اس کے باوجود ایک سادہ سا ہدایات وہ عوام کو دیا جا سکتا تھا کہ؛ یعنی قریب ترین قد کی عمارت میں جانے کے لئے اور سکون کے 4th منزل پر یا اس سے اوپر اور انتظار ہدایات پانی اترنے کے لیے اس لڑکی سپر ہیرو کی طرف سے دیا گیا تھا کبھی نہیں جب تک جانا - یا واقعی کوئی اور. سارا مسئلہ حل کرنے کے لئے اور ابھی تک لاکھوں لوگ بظاہر محض اوپر جا نہیں سوچا اتنا آسان تھا! قابل رحم کوڑا کرکٹ.,a ' ' embattled 30 ' ' chauvinist 4th
"لکھہ پتی بیاہی ایک خاتون ڈاکٹر سے. انہوں نے کہا کہ ایک دن میں کام کیا نہیں کیا ہے اور وہ اس کے پیشے کے لئے وقف کیا جاتا ہے. انہوں نے کہا کہ ہر روز اس کے دیکھتا ہے. کچھ دینا پڑا ہے. <br /> <br /> ہمارے ہیرو، ہنری فونڈا، آخر میں ان کی زندگی کے ساتھ کچھ کرنے کا فیصلہ کرتا ہے. انہوں نے کہا کہ ایک ڈپارٹمنٹ اسٹور میں ایک سیلزمین بن جاتا ہے لیکن غریب لوگوں ملازمت کی ضرورت ہے جیسے ہی فائرنگ کی ہے. اس دوران میں، ڈاکٹر ہیلن ہنٹ (باربرا Stanwyck) اس کی پریکٹس چھوڑ دی ہے؟ ایسا کرنے کے لئے؟ <br /> <br /> کرک (فونڈا) کیا ہے ایک دیوالیہ ہسپتال خریدتا ہے اور وہ ایک وجود باہر eke جبکہ دو اب خوش اعانت دوسروں ہو جائے گا. <br /> <br /> یہاں لکھنے کے ساتھ ہے ؟ اپنے شوہر سے ناراض کرتے ہیں، ڈاکٹر ہنٹ کا کہنا ہے، ""تم نے گسٹاپو کی طرح اداکاری کر رہا ہوں."" یہ ایک کامیڈی ہونا چاہیے ہے. Hogwash. <br /> <br /> ایک بہت بورنگ تکاؤ فلم. بہت کم یہاں پر جا رہا.",stanwyck eke hogwash
"آہ Animorphs. میں نے کتاب سیریز سے محبت کی اور بے تابی کے مڈل اسکول میں ہر ایک کو نگل گئیں اور میں نے ایک ٹیلی ویژن موافقت نہیں تھا کہ سن کر مجھے بہت حوصلہ افزائی کی تھی. <br /> <br /> لڑکے حتمی پیداوار تھا نیچا کیا. میں نے میرے لئے لگتا ہے، اس پل تھا Nickelodeon کے ٹھنڈا پروگرامنگ اور زیادہ عام کے بارے میں ہونے کی وجہ سے بند کر دیا گیا. <br /> <br /> اس لیے سیریز کے ساتھ کیا غلط تھا؟ مجھے طریقوں شمار ہیں: 1. حروف horrifically کا miscast تھے. کتابوں میں، Animorphs 12-14 کے درمیان کہیں تھے، ٹیلی ویژن کاسٹ میں کم از کم 18. جب میں پہلی کاسٹ تصاویر. <br /> <br /> 2 دیکھا مجھے خوفزدہ کیا جا رہا ہے یاد تھے. ہولناک اداکاری / برا تحریری طور پر. میں تھا جو میں ڑیلےدار بڑے پیمانے پر یہ تھا کہ میں lumping رہا ہوں تاکہ الزام عائد کرنا گئی. نہیں مضحکہ خیز - شاید یہ اس حقیقت کی آمیزش کے تیز عمر ہنسی مذاق میں کم از کم پیارا کیونکہ مارکو ایک 13 سالہ سے باہر آ رہا ہے کہ متاثر تھا. اصل میں، میں گروپ سے ایک بھی ہاسیکر لمحے یاد نہیں ہے اور چند تھے. اداکار یقینی طور پر اس کے بدترین اوپر اپنی بہترین اور سر smackingly قابل رحم میں کمزور تھا جس کے لکھنے سے کچھ مدد نہیں کر رہے تھے. <br /> <br /> 3. میرا رب وہ بجٹ کے ساتھ کمجوس تھے. اکیلے Andalites کی حتمی نتیجہ پلگ ھیںچو کرنے کے لئے Viacom کی بات پر یقین کرنا چاہیے تھا ... ان کے سروں کو واضح طور پر ظاہر ہوتا ہے کہ دراڑوں ہیلمیٹ تھا جس پڑا. <br /> <br /> 4. کاسٹ پر واپس جائیں - دور کی طرف سے راہیل سب سے بڑی دور کی کتابوں میں یودقا عورت، ٹی وی سیریز میں بہترین برابر ""Scarecrow کی"" تھا کیا جا رہا ہے سے نیچا تھا. اس کے علاوہ، میں جانتا ہوں کیسی آدرشوادی تھا لیکن ""آدرشوادی"" اور ""بیوکوف"". <br /> <br /> 5 کے درمیان ایک فرق ہے. کبھی بدترین افتتاحی عنوانات میں سے ایک. موسیقی کہ واضح ہو جائے کرنے کے لئے تھا؟ 6. جواب دے سوال 6، ""ہاں"" کیونکہ باقی سب کچھ نیچے تو کیوں امید کم ذہین ناظرین ایک لنگڑے ریپ راک رپ بند یا جو بھی جہنم تھا کی طرف سے ایک اینٹ نغمہ طور پر ایک موٹی نہیں حاصل کرنا چاہئے بی آر dumbed کیا گیا تھا. < /> <br /> اس کے بعد سے بڑے لشکر طیبہ چڑھاو (عراق، 2004) ہو چکے ہیں لیکن اس معاملے میں میں اپنے آپ کو صاف نہیں کر دیا ہے - اس شو چوسا اور کتاب سیریز اس سے مبنی ہونا چاہیے تھا کو نفرت تھی.",animorphs nickelodeon 1 horrifically miscast animorphs 12 14 18 2 lumping 13 smackingly 3 andalites viacom 4 scarecrow 5 6 6 dumbed 2004
اقبال تیرے عشق نے سب بل دئیے نکال۔۔۔۔مدت سے آرزو تھی سیدھا کرے کوئی۔۔۔۔۔❤️🖤❤️🖤❤️@Real_SHR9263#ImamKhadimHussainRizvi  #ApnaMuqamPaidaKr #URL#,real shr9263 imamkhadimhussainrizvi apnamuqampaidakr url
"میں یہاں اچھی جائزے پر مبنی اس فلم کو دیکھا، اور میں دوبارہ وہ غلطی نہیں کریں گے. <br /> <br /> پہلے جوڑے منٹ پتہ چلتا ہے کہ لوگوں کے ایک گروپ کو کچھ سانحے کی طرف سے ایک دوسرے کے ساتھ لایا گیا ہے، لیکن آپ ڈان 'ٹی دیکھیں کہ یہ کیا ہے. 12 گھنٹے فلیش بیک اور ہم ان لوگوں کو آخر میں کیا ہونے والا ہے کیا مکمل طور پر بے معنی ہیں جن میں سے ہر ایک کی بورنگ زندگی کو دیکھنے کے لئے ملتا ہے. ختم ہونے آخر میں لطف اندوز ہوتے جاتا ہے، آپ کو صرف ایک بڑا فوائد آپ کو دیکھ کر کیا گیا ہے کے لئے ہو اور اسباب کچھ بھی نہیں ہے کہ کے لئے آپ کی زندگی انتظار کے ایک گھنٹے ضائع ہو. صرف کنکشن ان لوگوں کے پاس وہ سب ایک ""برا دن"" پڑا ہے کہ ہے - لیکن تسلسل بوریت میں کھو جاتا ہے یہاں تک کہ <br /> <br /> اس ایک ""حادثے"" کلون ہونا چاہیے تھا، تو یہ ہے ایک مکمل ناکامی.",' 12
اوہ یہ واقعی سچ ہے. میں فلمیں دیکھا ہے میں نے جو کچھ بھی وجہ کی وجہ سے، زیادہ ناپسند ہے کہ، لیکن میں صرف فلم سازی کے ہر ایک پہلو میں ناکام ہو جاتا ہے کہ ایک فلم کبھی نہیں دیکھا ہے. یہ بھی اس فلم بنانے میں ناکام کرنے کے لئے ناکام ہو جاتا ہے ایک طرح سے نیویارک میں ہرکیولس ایسا کرنے کے لئے کہا جا سکتا ہے. یہ کم از کم کی طرح فلم میں نہیں ہے، لیکن یہ بہت بدترین فلم میں نے کبھی دیکھا ہے. <br /> <br /> اداکاری پہلی بات ہڑتالوں آپ کہ ہے. میں نے فحاشی کے بدتر کام کیا فلم کے باہر کبھی نہیں دیکھا. اصل میں میں فحش فلموں کو ایک لات سائٹ کو اس سے بہتر کام کیا جاتا ہے کی کافی مقدار ہے. یہ واقعی خوفناک ہے. <br /> <br /> تکنیکی طور پر، یہ خوفناک ہے. کیمرے کا کام شوقیہ ہے. ایڈیٹنگ نامعقول ہے. میں نے وہ مناسب آواز کے سامان کی متحمل نہیں ہو سکتی تھی سمجھتے ہیں، اور اس کا مطلب ہے کہ ایک گاڑی میں ہر منظر (اور ان میں سے ایک بہت کچھ ہے) انہیں جنگل کے اسی پیچ کی طرف سے فی گھنٹہ اور ہر باہر منظر سیٹ تین کے بارے میں میلوں میں ڈرائیونگ کر دیا ہے (اور ان میں سے ایک بہت کچھ بھی نہیں ہے) اصل میں ایک بار پھر بری فحش vibe کے لئے مزید قرضے، ایک سٹوڈیو سے ڈب کیا جاتا ہے. <br /> <br /> بہت سے نشاندہی کی ہے کے طور پر پلاٹ، نامعقول ہے. میں سمجھتا ہوں کہ جو باوجود سے Nosferatu کی طرف سے مقبول کیا جا رہا ہے، یہ کبھی نہیں اصلا ویمپائر mythos کی ایک اندرونی حصہ تھا حقیقت کی طرف سے دن کی روشنی میں چل ویمپائر کا دفاع کریں گے. <br /> <br ویمپائر mythos کی /> خطاب کرتے ہوئے مصنف نے واضح Carmilla پڑھا تھا ، یا بہت کم از دیکھا میں ویمپائر پریمی. مجھے متاثر طرف سے ایک گوتھک ناول میں بہت پسند ہوں کم از کم کچھ آکانکنوں ہے کہ ایک فلم کے اس سنگین swaying کے میں نے اس کے بارے میں کیسا محسوس کرتے ہیں اس بات کا یقین نہیں ہوں،؛ یا اس کی بہترین sledgehammer کے حوالہ جات کی طرف سے اور منبع مواد کی بدترین کل بے حرمتی پر ناراض. میں بہت کم از کم 'عمومی' پیٹر کشنگ کی توہین ہے اگرچہ. <br /> <br /> یہ ہو جاتا ہے دو ستاروں تاہم، محض اس وجہ سے میں نے ایک فلم ہے کہ کے لئے ایک ستارہ ووٹ ڈالنے کے لئے اپنے آپ کو نہیں لا سکتے، یا کم از کم منشاء، اس میں دونوں ویمپائر اور zombies ہے کرنا. اتفاق سے میں نے Lifeforce (ایک اور فلم tenuously اس میں پشاچ اور zombies ہے کہ) اس کے طور پر ایک ہی دن پر دیکھا، اور ایک نہیں بلکہ ناقص فلم خود ہونے کے باوجود، واقعی باہر اس کے مقابلے میں ایک شاہکار ہے. <br /> <br /> تو آخر میں، یہ ایک فلم نہیں ہے اتنا برا اس کی اچھی ہے، یا اس سے بھی نشے میں، کسی بھی طرح آننددایک میں ہے اتنا برا. یہ صرف ایک گندگی ہے، اور کوئی ایک کی مالیت دیکھ کر وقت.,vibe nosferatu mythos carmilla swaying sledgehammer ' ' zombies lifeforce tenuously zombies
"اس فلم کو Sommerset Maugham کی کہانیاں اپنانے کے لئے دوسری برطانوی رینک فلم ہے. 'کوآرٹیٹ' سے تمام لیکن ایک کہانی contempory دور میں اچھی طرح سفر نہیں کرتا؛ صرف برطانوی پری 1950 کے اداکاروں کی ترسیل ہو سکتا ہے کے طور پر اور اداکاروں تقریر واضع طور ""کاٹا گیا"" ہے. anycase میں 'تینوں' پہلی فلم کی موافقت سے سخت اور زیادہ filmic لگتا ہے. <br /> <br /> ان دونوں فلموں پر قابو پانے نہیں کر سکتے ہیں مسائل میں سے ایک ان کے منبع مواد سے قبل فلموں سے 25-30 سال لکھا گیا ہے . چنانچہ 1950 Maughm کے (پہلے سے جنگ) popularist طرف سے ""چھوٹے اخلاقیات"" storyteling بلکہ ولکشن، اگر نہیں سیدھا سادا ونیت لگ رہا تھا.",sommerset maugham ' ' contempory 1950 anycase ' ' filmic 25 30 1950 maughm popularist storyteling
#USER# اگر یہ سچا ہوتا تو اس کا یہ حال نہ ہوتا اللّه نے عمران خان کو سزا دی,user
"میں نے کچھ اچھی دیکھ سکتا تھا سوچا لیکن ... میں نے اس فلم کو دیکھنے کے بعد تھکا ہوا ہوں، مجھے سب سے زیادہ نفرت کرتا ہے پتہ نہیں کیا: اسکرپٹ، اداکاری، FX یا موسیقی. بدترین پاور رینجرز واقعہ کو تصویر کرنے کی کوشش کی اور اب بھی قسم کی کے لئے ہو گا. میں نے (پرتیبھا کے رابطے ہے ہڈی تلوار یا اس کی سانس کی ایک سبز دھواں میں لوگوں کو غائب کر رہی ہے اس کے ساتھ رابطے) FPS کھیل میں بہتر FX دیکھا ہے اور موسیقی ویسٹرن ایک سپتیٹی سے آنے لگتا ہے. مجھے پسند آیا تھا کہ کس طرح گاڑی میں عورتوں، چیخ گیا تھا جب ""شیطان"" کار (وہ غلط طریقے سے لگ رہا ہے یہاں تک کہ اگر) کے ارد گرد چل رہا تھا. تو تم اپنے نفس کو ایک دن روک دے اور، اس بات کو دیکھتے از کم کال کسی تک میں آپ کے ساتھ ایک ہارر فلم کو دیکھنے کے لئے نہیں ہے، مجھ پر اعتماد آپ کو کچھ کک کے لئے اجارہ داری کھیل ختم ہو گی.",fx fps fx
اے صحابہ کرام کاش! میری ماں زندہ ہوتی میں نماز عشاء پڑھا رہا ہوتا میری ماں ابھی محمد پکارتی میں نماز توڑ کر اپنی ماں کی بات سنتا عورت کی تکلیف کا اتنا احساس فرمایا گیا کہ دوران جماعت بچوں کے رونے کی آواز سنتے ہی قرأت مختصر کردی👇,
مغرب جہاں پہلے پہل مادر پدر آزادی نے خاندانی سسٹم کی بربادی کی اور اب یہ نئی لعنت مغرب میں اپنا رنگ دکھا رہی ہے جسکی علمبردار پاکستان میں بھی اس گند نا صرف لانے بلکہ اسکی ترویج و اشاعت میں پی ڈی ایم کی بے حیا حکومتی سرپرستی کے تحت پیش پیش ہیں۔ اللہ ہمارے حال پر رحم کرے۔ آمین2/2,2 2
"""انتہائی تبدیلی: ہوم ایڈیشن"" نام نہاد 'دل وارمنگ' ایک اور 'احساس-گوڈی'، ہے، اور باہر کے-لئے-ریٹنگز ABC دوسرے کے ساتھ ڈال کرنے کے لئے وقت دیکھا گیا ہے کہ دکھاتے ہیں <br /> <br /> میں. مشکلات کو سمجھتے ہیں ان خاندانوں سے گزرتی ہیں. اس کے لئے، مجھے افسوس ہے. لیکن آپ کو چار وسیع سکرین پلازما ٹی وی، تین فلیٹ سکرین ڈیسک ٹاپ کمپیوٹرز ڈال، ایک inground پول ایک گھر کے پچھواڑے کے نصف تک لے جا رہا ہے کہ لگتا ہے کہ، اور مہنگی ڈیزائنر لباس کی الماریوں بھرا کسی بھی خاندان کے لئے تھوڑا سا بھی ضرورت سے زیادہ ہے؟ ضرور، ان خاندانوں ایک بہت کے ذریعے کیا گیا ہے. ضرور، وہ اچھے چیزیں کیا ہے کہ وہ پہلے تھا کے مستحق ہیں. <br /> <br /> لیکن ایمانداری سے، چیزوں سے Ty Pennington اور ان کے گھروں میں ان کے عملے ڈال ایک پورے محلے کے مطابق کرنے کے لئے کافی ہیں. <br /> <بی آر /> ایک اور واقعی اس شو کے بارے میں مجھے شہری پریشان وہ چیز ہیں Ty اور ان کے عملے ہمیشہ کچھ اچھا خاندان، یا خاندان کی حالت سے متعلق ہے کہ ہر چھوٹی چیز کے بارے میں کیا کہنا ہے کس طرح ہے. ایک ویل چیئر جانے والی شخص کہہ رہا ہے کہ وہ یا وہ 'اتنی مضبوط'، یا 'بہت بہادر' ہے واقعی تھوڑی دیر کے بعد پرانے حاصل کرتا ہے. یہ اشج آواز، لیکن مجھ پر یقین کر سکتے ہیں؛ اس شو کو دیکھنے کے، اور آپ کو میرا کیا مطلب ہے نظر آئے گا. <br /> <br /> سب کے سب، اس شو اہنکاری ہے. آپ کو یہ دیکھنے کے لئے چاہتے ہیں، تو آگے بڑھو. یہ تبصرہ صرف آپ کو دیکھ کر کیا جائے گا، اس کے لئے ایک سر اپ ہے.",' ' ' ' abc inground ty pennington ty ' ' ' '
#USER# #USER# ان شا اللہ نہیں ھوں گے تو بس ارشد بھای نہیں ھوں گے,user user
#USER# #USER# #USER# ہمیں یہ کیا دے سکتے ہیں، ہمیں اپنے اللہ سے خیر کی امید ہے انشاء اللہ خیر ہوگیمیرا ایمان ہے بھائی,user user user
میں فورا کہ یہ بدترین فلموں میں نے اپنی زندگی میں دیکھا ہے میں سے ایک ہے تسلیم کرتے ہیں کر سکتے ہیں. اور یہ کہ، تھوڑا کہہ نہیں ہے کیونکہ مجھے یہ بددا فلم کی بات آتی aficionado کی جب اپنے آپ کو کسی حد تک ایک کے ہونے کا تصور کرتے ہیں. لیکن یہ برا سے باہر ہے. یہ فلم اس میں چھوڑ دیا کوئی مذاق نہیں ہے، تا کہ خوفناک ہے، یہ صرف برا ہے. <br /> <br /> جائزہ لیتے یہ تقریبا ناممکن ہے. کوئی مضبوط پوائنٹس اور کچھ مثبت کہنے کے لئے موجود ہیں. میں نے ابھی پوائنٹس چوسا کی کچھ کے بارے میں نہیں ramble لیں گے. پہلا دور، CGI بدترین میں دیکھا ہے میں سے ایک ہونا ضروری ہے. میں نے CGI CGI نئے اور تازہ تھا جب میں بابل 5 راستہ پیٹھ میں دیکھا ہے ہو سکتا ہے کچھ کی یاد دلاتی ہے، اس فلم 2005 میں بنایا گیا تھا پر یقین نہیں کر سکتے ہیں. یہ غریب پرے عقیدہ ہے. وہ دن کے وقت صابن کی بدترین قسم میں تعلق رکھتے طرح دوسرا، اداکاروں تمام پا رہے. اور ان کے شروع کو دیکھ کر میں نے صحیح ہوں کہ ... سوم، بہت بڑا رینگنے والے جانور نسل کے لئے قابل ہونے کے وہ اس فلم میں ایجاد دیگر ٹیکنالوجی کے لئے کوئی میچ ہے: لامحدود بارود کے ساتھ recoilless پستول! سنجیدگی سے، مائیکل Pare کی ہر دوسرے منظر میں دوبارہ لوڈ کے بغیر 100-200 اوقات آگ ہے ... جیسا کہ اگر کافی نہیں تھا وہاں بھی شکل-منتقلی طیاروں! پہلے تو انہوں نے باقاعدہ ایف 16 جنگجو ہیں، اگلے منظر میں وہ کسی اور کو مکمل طور پر کچھ اور ہو، اور تیسرے منظر میں وہ ایف 16 پھر رہے ہیں! آپ رہے ہیں، خرید اسٹاک فوٹیج، تو اس طرح اس کا اختلاط نہ کریں! <br /> <br /> سچ میں، بوجھ زیادہ کہنے کی نہیں ہے، لیکن میں روک دیں گے لگتا ہے. آپ سب کہ میں کیا کہہ رہا ہوں سمجھنے کی. سچ میں، فلم کی اس قسم کی کوئی اور بنایا گیا تھا سوچا ہی نہیں. یہ کچھ ایڈ لکڑی کرے گا ایسا ہے. معیار کی مکمل جاہل، دیکھ بھال نہ کچھ بھی لگ رہا ہے ... یہ سب اس کے awfulness میں تقریبا حیرت انگیز ہے کہ کس طرح. میں نے اسے دے تو سکتے تھے 0/10 میں کروں گا، لیکن 1/10 سب سے کم گریڈ ہے. تو یہ بات ہے.,aficionado ramble cgi cgi cgi 5 2005 recoilless pare 100 200 16 16 awfulness 0 10 1 10
