text,normalized_text
"میں نے اپنی پسندیدہ مزاحیہ کتاب ہیرو ٹیلی ویژن پر ہونے کے تصور پر حوصلہ افزائی کی تھی ... اور sorely کی آخر نتیجہ میں مایوس کیا. <br /> <br /> صرف ""حیرت انگیز"" چیز داخلے دیوار (کی مرئیت باوجود تھا کیبل). میں نے نک ہیمنڈ پیٹر پارکر تھا سوچا ہی نہیں تھا ... اور وہ آدمی مکڑی سوٹ میں سٹنٹ تھا جو اس سے مختلف تعمیر کے واضح تھا. آپ کو بتا سکتا ہے کہ وہ دو مختلف اداکاروں تھے. <br /> <br /> عطا، میں نے بھی جدید مکڑی مین فلموں میں ٹوبی Macguire کی طرف دیکھ رہا ہوں اور میں CGI کی طرف دیکھ رہا ہوں جب جب میں دیکھ سکتے ہیں. لیکن اس کے CGI کے ساتھ ایک تربیت یافتہ نظر اور تجربہ ورکنگ سے ہے. پھر بھی، 70 کے ورژن خصوصی FX کی کمی کے باوجود بہتر ہو سکتا تھا. <br /> <br /> جالے سے The Hokey تھے اور ان کے لئے چھڑی کی بجائے چیزوں کے ارد گرد لپیٹ کرنے کے لئے لگ رہا تھا کہ رسیاں طرح دیکھا. اور کیا اس میں کے ارد گرد سواری کے لئے ایک مکڑی موبائل دینے کے ساتھ تھا. ہیلو؟ انہوں ویب Slinger کی لوگوں ہے. <br /> <br /> معذرت ... تو اپ کام کیا، لیکن ہمارے پیارے دیوار کرالر بہتر مستحق حاصل کرنے کا مطلب یہ نہیں تھا.",sorely macguire cgi cgi 70 fx the hokey slinger
ﻧﮧ ﮨﯽ ﻣﻘﯿﺪ ﮐﺮﺗﮯﮨﯿﮟﻣﺤﺒﺖ ﻧﺎﻡ ہےﻧﻔﺮﺕ ﮐﯽ ﺑﻨﺪﺵ ﺳﮯ ﺭﮨﺎ ﮨﻮﻧﺎﻣﺤﺒﺖ ﻧﺎﻡ ﮨﮯﺩﻝ ﮐﮯ ﻗﻔﺲ سے ﺁﺭﺯﻭ سےﺁﺯﺍﺩ ﮐﺮﺩﯾﻨﺎﺗﻮ ﭘﮭﺮ ﺍﯾﺴﺎ ﮐﺮﻭ ﺗﻢ ﺑﮭﯽ!ﭘﺮﻧﺪﻭﮞ ﮐﻮ ﺭﮨﺎ ﮐﺮﺩﻭﺍﻭﺭ ﻣﭩﮭﯽ ﮐﮭﻮﻝ ﮐﺮ👇,
عنوان، تبدیلیوں بالکل کسی بھی اچھے تھے تو جو اتنا برا نہیں ہو گا میں سے ایک لفظ کے لئے مریم شیلے کی کہانی کو حقیقت سے لاٹھی 'Frankenstein کی لعنت ہے'. Frankenstein کی خاندان تباہ مخلوق کے سانحے کو مکمل طور پر excised اور ساتھ ... کچھ بھی نہیں تبدیل کر دیا گیا ہے. دل اور کہانی کا اخلاقی مرکز چلا گیا ہے. ایسا لگتا ہے کہ اس میں Frankenstein ایک conniving کے، کپٹی قاتل ہے نہ مدد کرتا ہے؛ وہ ہو جاتا ہے ہر چیز کا مستحق ہے. پلاٹ بنیادی طور Frankenstein کے clichés میں سے ایک اتلی چیک لسٹ ہے. یہاں تک کہ اس کی اپنی شرائط پر لے لیا ہے، اس قسم کی معمولی ہدایات ہے: ایک کھیر کٹورا بال کٹوانے کے ساتھ ایک shite نظر مخلوق کی خاصیت ایک کمزور، بے خودی فلم. یہ ہتھوڑا کی ہارر فلموں، Terence کی فشر کی طرف سے ہدایت کی اور پیٹر Cushing اور کرسٹوفر لی ابنیت کے پہلے ہے کے طور پر، ہارر تاریخ میں اس کی جگہ محفوظ ہے. لیکن یہ گھٹیا ہے.,'frankenstein ' frankenstein excised frankenstein conniving frankenstein clich s shite terence cushing
"Eastenders مکمل طور پر انتہائی پست اب 1985 میں unmissable میں سے مکمل دائرے چلا گیا ہے. اس قوم کی اتنی بری عکاسی اس گھٹیا درجہ بندیوں میں سب سے اوپر ہے. <br /> <br /> پلاٹس خیالات ایک ٹوپی میں کبھی کرداروں کے نام ڈال سے زیادہ معمولی کچھ بھی نہیں پر مشتمل ہو سکتا ہے. پہلے دو باہر (قطع نظر ان کی جنس کے) ایک دوسرے کو، 3rd کی اور 4th کے باہر کے ساتھ سو جائے گا اخت میں ایک جنگ پڑے گا، 5th کے ایک کے 6th کے ایک عادت ترقی کو گرفتار کیا جائے گا، 7th کے حاصل حاملہ وغیرہ وغیرہ <بی آر /> <br /> پروڈیوسروں ہوشیار اگرچہ ہیں. 30 منٹ شو صرف اصل میں کبھی 3 لائنوں پر مشتمل ہے. <br /> <br /> 1) کسی نے اخت میں چلنے اور کہیں گے ""پر چل رہا ہے کیا؟"" 2) کسی اور کا کہنا ہے کہ کھڑے ہو جاؤ گے ""AHT اسے چھوڑ"" () 3) اس کے بعد ایک عورت کہیں گے ""حکمت 'این' توہین ایم اے fam'ly پہلے میں آئے CHOO"" <br /> <br /> بس. یہ ہر شو ہے. علاوہ کبھی کبھار ""اسے حاصل چھانٹیں-ID / اسے چھانٹیں-ID ہے؟"" <br /> <br /> شو ایک بار ایسٹ اینڈ لوک & زندگی کے ان کے راستے کا ایک حقیقت پسندانہ چترن تھا. 1) وہ ایک ہفتے میں دو راتیں اور 2) سلیٹر خاندان کو تبدیل کر دیا سے اسے بڑھا دیا جب buffers کے دور آیا. وہ کس طرح کے ناظرین کو اپنی طرف متوجہ مجھ سے باہر ہے. Kat کی کردار کسی اور علاج کسی چیز وہ اپنے جوتے کے نچلے حصے سے دور نکالا ہے جیسے، معاشرے کے ساتھ گئی غلط ہے کہ سب کچھ کی علامت ہے. <br /> <br /> لوگ، اس کے بہترین کردار ووٹ ڈالنے والے ان انتخابات میں لازمی طور پر ایک ہی والوں حقیقت کے باوجود انہوں نے 3 سال کے لئے ایک کھیل کھیلا نہیں کیا ووٹ جیمی Redknapp نے 'بہترین کھلاڑی' ہے. <br /> <br /> شو کیوں سب کر برطانوی ٹی وی کے سربراہی ہے تو کیا میں نے کبھی نہیں سمجھ سکتا ہے سب سے بڑا ناموں چھوڑ دیں؟ راس کیمپ، مارٹن کیمپ، فہرست لامتناہی ہے. <br /> <br /> طویل ترین جوڑے کی شادی کب تک جاری رہی ہے، ان کو ایک دوسرے کے وفادار ہونے کے ساتھ؟ جی ہاں، لوگوں کو چھوڑ، لیکن جب تک اسکرپٹ لکھنے والوں جو کہ حروف کا احساس، جوڑے شو کے ارد گرد سو خراب کرنے کے لئے جاری رہے گی بغیر دلچسپ اور دلکش ہو سکتا ہے. ایک واقعہ گزشتہ ہفتے بالکل اس کے 3 الگ الگ پلاٹ پڑا. اور ZOE اور ڈاکٹر سب بھی بلند و بالا اور 'شیل' 'کے طور پر سب سے زیادہ ناقابل یقین جوڑے کبھی ٹی وی پر دکھائے جانے.' <br /> <br /> ہاں، Eastenders سب سے زیادہ دیکھا شو، thats کے نروئواد ہے. لیکن بہت سے بیرونی عوامل کہ میں شراکت. 19.30 / 20.00، سب سے زیادہ سامعین شخصیات حاصل کرنے کے لئے دن کے بہترین وقت ہے یہ ناظرین کے لاکھوں، اسے دیکھنے زیادہ عادت کے مقابلے میں کچھ بھی نہیں کے باہر 2 گھنٹے کے لئے ایک تمام ایڈیشن ہے، اور اس سے زیادہ مگر وہ مکمل طور پر ایماندار تھے تو خود کے لئے، وہ (2002 میں، پہلے سے زیادہ)، یہ بالکل قابل رحم ہو سکتا ہے کہ تسلیم کریں گے.",eastenders 1985 unmissable 3rd 4th 5th 6th 7th 30 3 1 2 aht 3 ' ' fam'ly choo id id 1 2 buffers kat 3 redknapp ' ' 3 zoe ' ' ' ' eastenders thats 19 30 20 00 2 2002
میں وزیراعظم شہباز شریف کے نئے لگائے گئے آرمی چیف جنرل سید عاصم منیر کو پاک افواج کی کمان سنبھالنے  پر مبارکباد پیش کرتا ہوں اور امید کرتا ہوں کہ وزیراعظم شہباز شریف صاحب کا یہ فیصلہ پاکستان کے تحفظ اور امن و امان کے لیے خوش آئند ثابت ہو گا۔انشاءاللہ,
مسٹر موٹر گیمبل ایک منصفانہ براہ راست آگے پلاٹ ہے - ایک باکسر ایک پراسرار زہر کے ساتھ رنگ میں قتل کیا جاتا ہے جب، یہ کیس حل کرنے کے لئے اس سے بھی زیادہ پراسرار مسٹر موٹر پر منحصر ہے <br /> <br /> میں ہوں. نامہ پر مسٹر موٹر گیمبل کے لئے مثبت جائزے کی تعداد میں حیران. میرے پاس چونکہ ... ٹھیک ہے، میں نے اسے انتہائی مایوس کن پایا. میں نے مسٹر موٹر لطف اندوز اور میں چارلی چان سے لطف اندوز، لیکن میں نے دو کے اس mish- سانی کے لئے دیکھ بھال نہیں کہہ سکتا. مسٹر موٹر گیمبل کے پیچھے کی کہانی سے نا واقف لوگوں کے لئے، یہ اصل میں ایک چارلی چن فلم ہونے کا ارادہ کیا تھا. لیکن وارنر اولاند حمایت یافتہ آؤٹ ہونے پر، مناظر اور کارروائی کے کچھ پیٹر Lorre اور مسٹر موٹر لئے دوبارہ کر رہے تھے. میں نے اس بات کا اشارہ کے طور پر، آخر نتیجہ بائیں مجھ سے underwhelmed. مسٹر موٹر چان نہیں ہے. انہوں نے کہا کہ زیادہ پراسرار ہے، وہ زیادہ اتھلیٹک ہے، اور وہ زیادہ غیر ملکی ہے. چنانچہ ایک چان فلم میں گرم، شہوت انگیز ڈال کرنے کے لئے ہے ایک گول سوراخ میں ایک مربع پت فٹ کرنے کی کوشش کی طرح کی کوشش کر رہا ہے - یہ کام نہیں کرتا. اور Lorre کو سننے / MOTO چان کی ٹریڈ مارک euphemisms میں سے ایک فراہم کرنے کے لئے صرف پاگل آواز ختم ہو جاتی ہے کوشش کریں. حقیقت یہ ہے کہ تقریبا 10 منٹ پہلے سے ہی بریف کہ 72 منٹ رن ٹائم باکسنگ کے مناظر (کچھ ہے کہ مجھے سے لطف اندوز کرنے کے لئے لگ رہے ہو کبھی نہیں) سے بنا ہوتا ہے اور آپ کو ایک فلم کے ساتھ ختم ہو کہ مجھے مدد کی لیکن ناپسند نہیں کر سکتے تھے میں شامل کریں. میں نے کچھ مثبت کہنا ہے تو مجھے Keye لوقا کی کارکردگی کی طرف اشارہ کریں گے. لیکن پھر بھی وہ معذرت میری آنکھوں میں مسٹر موٹر گیمبل بچانے کے لئے قریب کافی نہیں ہے. <br /> <br /> لیکن ایک 4/10 میں یہ ایک دے سکتے ہیں سب کے بارے میں ہے.,mish lorre underwhelmed lorre moto euphemisms 10 72 keye 4 10
#USER# اپنے لئے بھی دعا کیا کرو، اللہ آپ کی بیماری دور کرے۔,user
جائزے کو پڑھنے کے بعد مجھے ایسا پتہ چلا کہ میں واحد شخص اس فلم میں بہت مایوس تھا جو نہ ہوں راحت محسوس کر رہا ہوں! میں نے ایک بار سے ان میں سے اکثر ایک بہت بڑا نکولس Sparks کی پرستار ہوں، ہم سب ان کتابوں میں پڑھا ہے. یقینا میں نے نوٹ بک اور سیر یاد رکھیں کرنے کے لئے ... میں نے ابھی تک میں نے ان لوگوں کو ... <br /> <br /> لیکن میں نے کیا تھا پر تبصرہ نہیں کرسکتے لہذا Rodanthe میں ایک بوتل یا راتوں میں پیغام دیکھا ہے سے محبت کرتا تھا پیارے جان دیکھیں یہ گزشتہ ہفتے کے آخر میں جائیں اور مجھے بہت پریشان کر رہا تھا! فلم بالکل اچھا نہیں تھا! اکیلے فلم کو دیکھ کر جب، اور بالکل کتاب کے بارے میں نہیں سوچ، یہ اب بھی ایک خوفناک فلم تھی. میں نے جلدی حاصل کرنے اور اس فلم کے کہ میں دوسرے کی فلموں میں مزہ آیا، خاص طور پر نوٹ بک سے مل گئی ہے سے جذبات کی حد نہیں تھی. میں مسکرا رہا تھا نہیں اور ہنستے اور روتے ہوئے اور پریشان اور خوفزدہ ... کبھی! بہت سے سب میں نے نوٹس کر سکتے تھے ابتدا سے کیا گیا تھا کہ کس طرح انہوں نے سب کچھ بدل گیا! اس فلم کے بارے میں صرف ایک ہی چیز کتاب کی طرح ہے کہ صرف کے بارے میں ہے فوج میں ہے جو جان نامی ایک آدمی ہے اور کون نہیں ہے سوانا نامی ایک لڑکی .... اپنے والد کے بارے میں حصہ سککوں کے ساتھ پاگل کیا جا رہا ہے کہ وہاں ہے دوسرے حصہ کتاب کے ساتھ ساتھ چلا گیا ہے. باقی سب کچھ مکمل طور پر بند تھا !!!! سب سے پہلے، کتاب میں، ایلن ٹم کے چھوٹے بھائی، نہیں اس کے بیٹے کا تھا! وہ اس کو تبدیل کرنا پڑا کیوں، مجھے سمجھ میں نہیں آتا. یہ کتاب میں کس طرح چلا گیا یہ ایک بہت زیادہ احساس بنا دیا ٹم صرف تھوڑا سوانا سے زیادہ پرانے کاٹا اور انہیں ایک دوسرے کے ساتھ پلا بڑھا تھا جب اور ایلن گھوڑوں اور آٹسٹک بچوں کے ساتھ کام کرنے کی خواہش کے لئے سوانا کی مثال تھا .... کہ ایسا نہیں ہوا فلم میں .... اہ ... اور کتاب میں وہ بہت زیادہ وقت ایک دوسرے کے ساتھ صرف ان لوگوں کے ابتدائی 2 ہفتوں کے مقابلے میں گزارے اور پھر 1 رات ... کیوں وہ ان اوقات سے باہر چھوڑ دیا ؟؟؟ میں پر اور پر اور پر جا سکتے ہیں لیکن پھر میں جگہ ختم ہوتی! تو بنیادی طور پر، آپ نکولس چنگاریوں کا ایک بڑا پرستار ہیں، تو اس فلم پر اپنا وقت یا پیسہ برباد نہ کرو ... صرف کتاب دوبارہ پڑھا ... اس کتاب کی طرح خوفناک اور کچھ بھی نہیں ہے کیونکہ!,sparks rodanthe 2 1
ہم سب ایک خاص چیز کی خواہش ضرور کرتے ہیںپر جس وقت ہم اس چیز کی تڑپ میں ہوتے ہیں تو وہ ہماری پہنچ میں نہیں ہوتیاور جب ہماری خریدنے کی استطاعت ہوتی ہے تو وہ چیز موجود نہیں ہوتی یا پھر اب کی بار ہماری رغبت ختم ہو جاتی ہےاسی طرح زندگی میں بہت کچھ صرف دیکھنے کی ہی حد تک ہوتا ہے,
وہ اتنے فاصلے پر تھا کہ مسلمانوں کے تیر وہاں تک نہ پہنچ پاتے۔ مجبورا اسے اس کے انجام سے دوچار کرنے کے لیے قلعہ فتح ہونے کا انتظار کرنا پڑا۔ جبکہ مسلمانوں کی خواہش تھی کہ اسے ایک لمحے سے پہلے جہنم رسید کر دیا جائے۔یعقوب بن جعفر کہنے لگے: ان شا اللہ میں اسے واصل جہنم کروں گا 👇۔,
دھونس دھمکیاں،دباؤ ،لالچ ،حملے ہر حربہ استعمال کیا گیا لیکن مولانا صاحب کو زیر نہیں کیا جا سکا جمعیت ان شإاللہ ہر دور میں باطل اور لادین قوتوں کا راستہ روکتی رہیگی #MaulanaInKohistan,maulanainkohistan
آرزوۓ وصال کے آگے زندگی کتنی مختصر ٹھہری...کچھ نہ ٹھہرا جہانِ گرداں میں ایک تیری آرزو، مگر ٹھہری...🍁❤❤❤,
"اور تم جانتے ہو کیوں؟ کیونکہ انہوں نے سوچا (یا کم از کم بنایا ہارر شائقین کو لگتا ہے) قابل نفرت، گندے والا، چللا نوعمر افراد کے ایک گروپ ہے، کچھ پاگل شیاطین (کہاں وہ آئے کس سے؟ ان کے مقاصد؟ کون جانتا ہے؟) اور ایک سیاہ حویلی ہیں آپ کو ایک ہارر فلم بنانے کی ضرورت ہے. کہنے کی ضرورت نہیں، وہ غلط تھے. آپ یہ بھی ایک سکرپٹ ہے، کچھ منطق، کچھ شرائط ہیں، اور کچھ ایجاد کی ضرورت ہے. یہ فلم اس کی شہرت (لپسٹک منظر، کورس کے) تک رہتا ہے کہ ایک منظر ہے، اور مضحکہ خیز لمحات کے ایک جوڑے (اپنی ماں کے کوکیز کا بچہ بھائی کی تفصیل، Linnea کی کوئیگلے کے منظر ""مجھ پر نظر نہیں ہے""). یہ بھی میں نے گزشتہ دیکھا ""ذخیرے کتے"" کے بعد دیکھی گئی کسی فلم سے زیادہ تحقیر ہے. لفظی ہر چوتھے یا پانچویں لفظ ایک ""F ***"" یا ایک ""B ****"" ہے. پھر، ایک فلم FOUR اپنے پہلے 5 منٹ میں جھوٹے ڈراتا ساتھ شروع ہوتا ہے جب، آپ کو کچھ بھی اچھا فلم سازی مشابہت کی توقع کرنا نہیں جانتے. (* 1/2)",linnea f b four 5 1 2
#خاتم_النبیین_محمدﷺسیشن: #شان_اولیاءِکرام_رحمتہ_اللہ_علیہمفخر حاصل کرنے کا موقع حاصل ہو سکے اس سے معلوم ہوتا ہے کہ حضرت رابعہ بصری رحمتہ اللہ علیہا رضائے رسول اکرمﷺ️ کی طالب تھیں اور یہ آرزو رکھتیں تھیں کہ ان کی وجہ سے4,4
#USER# بھائ آپ نے اپنی یہ اپنی ٹائیم پے لکھا ھے کیا آپ کو اپنے الفاظ پر یقین نہیں یا آپ بھی نیازی ھیں کی طرح یوٹرن لے رے ھیں۔؟ آپ نے جو لکھ دیا وہ کافی ھے ان کے لیے۔۔ جزاک اللہ #URL#,user url
"آپ کا وقت برباد نہ کرو. پلاٹ کھینچ لیتا، حروف لکڑی اور uninteresting ہیں، ان کے اعمال کی منشا مکمل طور indecipherable ہیں. ""رومانٹک"" یا ہونے کے لیے ""مزاحیہ"" کے لئے انتظار کرتا رہا، اور کچھ بھی نہیں ہوا. بدتر ابھی تک، محبت خط بھی رومانٹک نہیں ہے، لیکن اس کی طرح آواز ایک ڈیڈ لائن بنانے کے لئے بیتاب کسی کی طرف سے لکھا گیا ہے. میں نے ذکر ""پلاٹ موڑ"" جو ہم نے فلم میں 15 منٹ سے آتے دیکھا، ""ہالی وڈ ہوشیار"" تھا اس کے معنی یہ جھٹکا کرنا ہے، لیکن ہالی وڈ دیا mentality- ایسا کچھ بھی نہیں کرتا ہے، اور اس کی بجائے مبہم طور پر جارحانہ ہے کیا. <br /> <br /> یہ قابل بھی کرایہ پر $ 2 ہے. یہ دیکھ کر پریشان نہ کرو.",uninteresting indecipherable 15 mentality 2
میں نے اس فلم کے لئے کچھ امید تھی اگرچہ میں جیسن Segel (شیطان اور گیکس، اگھوشیت) اتنا کا اداکاری سے لطف اندوز خاص طور پر کے بعد سے، میں نے اس میں حالیہ یاد (ہارا اور ڈاکٹر ٹی میں دیکھا ہے بدترین فلموں میں سے ایک تھا یہ کہنا ضروری اور خواتین کی فہرست میں بھی ہیں). <br /> <br /> ہاں، فلم میں بہت زیادہ بہتر ہو سکتا تھا اگرچہ، لاؤڈ لمحات باہر ہنسی کے ایک جوڑے تھے. بنیاد ان کی میچ کالج ملو ذریعے ان کے راستے دھوکہ دے جب وہ ان کے لئے ایک تجویز کے ساتھ کسی کی طرف سے دریافت کر رہے bad- اسکینڈل فنکاروں نہیں تھا. مسئلہ حروف، سب اتنی unlikable تھے کہ میں ان میں سے کسی کی پرواہ نہیں تھی کہ ہے. blackmailer (باصلاحیت جیسن Schwartzman کی طرف سے ادا کیا) اس طرح ایک منوروگی جو کریم ہے کہ وہ ایک خاص طور پر مضحکہ خیز یا دلکش انداز میں الجھا ہوا نہیں تھا کو دیکھنے کے لئے مضحکہ خیز ہے، وہ اصل میں نہیں بلکہ خطرناک تھا جو صرف ایک پاگل ہارے ہوئے تھے کہ نہیں تھا اور دیکھنے کا مزہ نہیں. فلم کی ایڈیٹنگ جو فنتاسی اور حقیقت کے درمیان کاٹنے رکھا follow-- مشکل تھا اور یہ تھا جس جو اکثر غیر واضح تھا. صرف دو یا گروہ کے گھوٹالے کے تین واقعی دکھایا گیا ہے، آپ کو صرف یہ ہے کہ وہ اپنی اسکیموں دکھا artists-- یقینا اسکینڈل تھے ایمان پر لینے کے لئے ایک بہتر فلم کے لئے بنایا جائے گا تھا. نام نہاد محبت کی کہانی حقیقت میں یہ احمقانہ اور غیر تسلی بخش لکھا گیا ہے اور پورے ہدایت کی تھی، مضحکہ خیز اور ناقابل یقین تھا. میں نے فلم کی کوتاہیوں کے بارے میں جا سکتے ہیں، لیکن آپ کو اندازہ ہو. قابل نہیں $ 4 رینٹل یا گیس جو کرایہ پر کرنے اور فلم سٹور سے گاڑی چلانے کے لئے لیتا ہے!,segel bad unlikable blackmailer schwartzman follow artists 4
اسلام علیکماللہ تعالیٰ آپ سب کی زندگیوں میں آسانیاں پیدا کرے ہمشہ خوش اور آباد رکھے اپنوں کے ساتھ آمینصبح بخیر زندگی #URL#,url
#USER# بے شک ان شا اللّه آمین جزاک اللّه بھائی 🌻🌻☺#TLP_Promotion,user tlp promotion
#USER# سلمان صاحب اک جالندھر والا جرنیل گیارہ سال کڈ گیا سی، تے اے وی پچھوں جالندھر دے نیںاللّہ ای خیر کرے.,user
میں نے ابھی اس فلم کو دیکھا. مجھے soundtrack.I وآلہ پہلا ٹریلر کو پسند کیا اور شاندار تھا، تمام ہالی وڈ کی فلموں کی طرح، وہ جانتے sell.But کو فلم تقریبا خوفناک ہے سب سے پہلے 30 منٹ کے دلچسپ ہیں، لیکن پھر .... کہ کس طرح تقریبا تمام نئی فلموں کی طرح وہ اس کو اڑانے. اس بچے مر گئے کیوں ؟؟ ایک کہاوت، ہر NIGGA کے 'فلم ایک بچہ ہونا ضروری ہلاک کیا جائے ہے میں نے خیال حاصل نہیں ہے، اور سب اچھا ان death.LOL.I بعد کیا تعلق ہے سمجھ میں نہیں آتا بننا چاہئے فلم کے ساتھ ... اور تو امکانات، آپ کو اس فلم میں بہت پہلے minutes.Nothing نئے سے آخر جانتے جاتا ہے. میں نے دیکھا 'تمہیں خدمت کر لی' ایک ہی خیال بلکہ ... کچھ نیا ... اس 'شہد' کی طرح کچھ ہے، لیکن اگر آپ کوئی دوسرا آپشن یہ مووی دیکھنے پڑے them.If درمیان تھوڑا سا فرق نہیں ہے، لیکن اس بات کا یقین آپ کو لینے کی آخری آپشن ہے. اور کوریوگرافی پہلے سب کچھ کے مقابلے میں سب سے زیادہ ہے. یہ ایک بات کا یقین کے لئے ضرور دیکھیں نہیں ہے ...,soundtrack i sell but 30 nigga ' death lol i minutes nothing ' ' ' ' them if
